{
  "status": "done",
  "packet_id": "BETA-01",
  "run_id": "run-f612c35dc18771f4bcde5e85dfc4e162",
  "lease_id": "lease-beta-01-local",
  "lease_generation": 1,
  "executor": "codex",
  "observed_heads_before": {
    "local_main": "work/collaboration-operations-platform-alpha-omega-20260803"
  },
  "observed_heads_after": {
    "local_main": "work/collaboration-operations-platform-alpha-omega-20260803"
  },
  "changed_paths": [
    "receipts/packets/beta-01.json"
  ],
  "predicate": "./scripts/gates/packets/beta-01.sh",
  "checks": [
    {
      "command": "python3 scripts/check-collaboration-operations-plan.py",
      "status": "pass"
    },
    {
      "command": "python3 scripts/repo-genesis.py --name collaboration-operations-platform --org organvm-iii-ergon --class operation_private --evidence docs/continuations/collaboration-operations-platform-genesis-20260802/workstream.json --seed-extract institutio/collaboration-operations/platform.yaml --why \"universal private collaboration operations and records hub; no collaborator grants; client records stay partitioned; synthetic fixtures only\" --dry-run",
      "status": "pass"
    }
  ],
  "spend": {
    "commands": 0,
    "tokens": 0,
    "minutes": 0
  },
  "outcome": "Preflight for target repository genesis passed through offline dry-run gates; naming/class/seed/evidence constraints are met for organvm-iii-ergon/collaboration-operations-platform."
}
